nombre,descripcion,precio,stock,id_tienda,id_categoria
Calidad,Será natural nuestro partes españa cierta c e.,86.59,14,398,2
Movimiento,Central serán riesgo volvió paz sólo ministro.,98.18,81,246,1
Valores,Pública finalmente realidad haya tribunal mis mucha.,91.47,63,205,6
Especial,Actividad varios durante económica.,90.99,7,35,1
República,Origen vino conciencia.,43.21,6,72,9
Quienes,Rey comunicación mal luego hermano salud.,67.52,82,103,6
Es,Camino amor director espacio.,49.5,67,388,2
Puede,Serán constitución sociales.,21.72,14,160,5
Algún,Algunos color las.,18.73,62,37,9
Podemos,Mercado desarrollo ella juez hubiera éste organización.,25.46,65,497,7
Ellas,Política seis hablar millones edad ésta.,71.92,55,412,1
Relación,Oro dio podrá libertad muy toda natural fuerzas.,67.67,23,35,4
Hizo,Carrera estas demás afirmó contrario autor.,7.1,6,56,2
Pensar,Origen d hacía jamás propio.,3.52,51,263,3
Día,Juan ninguna aún ministerio pp niños solución.,85.48,86,24,4
Libre,Supuesto tras principal diversos encuentro número solo.,83.12,24,42,2
Habrá,Día dolor ellas luis tomar casa marzo.,43.78,35,405,6
Llevar,Comunidad boca señaló experiencia días.,72.89,86,416,6
Medidas,Bien quienes pesetas ciento tarde encuentran opinión.,80.97,27,398,6
Alguna,Unión ministro barcelona cultural.,57.94,85,114,7
Universidad,Obras concepto piel donde.,77.61,24,247,3
Objetivo,Conseguir cuanto área vía programas mira alta.,67.57,14,302,7
Primera,República les diversas recursos peor allá septiembre.,11.16,68,256,5
Piel,Actividades enero demasiado nuevos parís aquí técnica.,62.34,77,162,8
Domingo,Estos público mundial carne generales martín productos.,8.63,29,165,1
Elecciones,Acerca origen mejor principio creo.,52.41,52,434,8
Esto,Claro experiencia vuelta existe menos unidad volvió ciudad.,57.11,93,219,5
Quien,Época visita aquí.,22.1,11,319,2
Estados,Estoy fiscal mitad.,80.29,88,300,5
Alrededor,Fuera idea viene calle luis igual somos felipe.,30.72,96,199,3
Comunicación,Cambio autor fuera.,76.46,57,480,7
Pese,Superior mejor blanca antonio.,98.74,85,157,2
Lenguaje,Falta llama cierta otras teatro.,79.48,100,94,7
Sido,Producto hacerlo allá comunicación.,62.33,99,441,6
París,Buscar figura mientras obra podría américa.,83.96,82,405,6
Domingo,Régimen civil cuarto también.,87.69,77,147,8
Menos,Ley pablo fuera personal fútbol posible otras dónde.,94.18,92,162,1
Aire,Luz intereses otra quizá alta haciendo esto.,28.51,58,270,4
Fuerza,Valores otras llamado líder aire.,15.61,87,317,9
Pueden,Nadie lo estados capacidad prueba.,73.38,99,410,3
Siete,Misma encuentra llega base.,71.46,8,304,5
Figura,Proyecto técnica temas de muchos r máximo plan.,7.81,32,433,4
Oposición,Consumo teoría equipo juez anterior.,48.24,14,488,10
Caso,Comisión dice junto quiero palabras.,86.05,60,116,1
Lado,Contrario casa viejo superior soy.,11.67,83,352,1
Resulta,Conjunto valores época señor i efecto.,23.78,35,473,1
Sea,Nuestras importancia garcía luis tribunal.,95.48,84,242,9
Eran,Campaña chile hombres cuya efecto.,41.33,29,166,10
Amigos,Equipo unidad distintas.,10.38,46,161,10
Distintas,José c miembros pequeño.,28.81,87,384,10
Animales,Final principios siguientes esta tipos.,76.28,64,429,2
Media,Profesional ojos siquiera revolución podemos idea.,57.23,22,308,9
Creación,Este primera siquiera sean lado gonzález allá.,15.2,14,269,6
Necesario,Fernando exterior trabajadores según carne.,26.64,97,462,2
A,Tras humana m todas.,57.65,55,169,3
Hablar,Política puede fuentes nivel.,88.11,91,162,6
Nuestras,Productos largo maría popular américa consejo.,18.84,72,206,1
Según,Juan dolor juan.,43.02,61,189,4
Opinión,Local principal por contenido figura términos etapa.,82.22,98,306,3
Concepto,Carrera campo principal electoral.,92.13,49,118,5
Sus,Temas política europa juez.,32.02,42,477,10
Mayo,Estados considera tenemos obras precisamente donde voz.,26.71,88,268,2
Mediante,Público riesgo se cuando ser julio carrera.,90.75,51,430,5
Poner,Recursos g trabajadores caso.,89.68,78,453,2
Aire,Carne seguro popular muchas.,19.24,69,190,5
Especie,Mayores seguro líder muchas.,22.9,23,478,1
Importante,Su clase destino apenas nosotros.,19.32,10,133,8
Medios,Llegó efecto carrera naturaleza resulta pueden.,48.23,76,146,8
Carrera,Les posible elementos habían arriba grupo algo.,50.81,77,244,3
Radio,Españoles debido pacientes marzo como trabajo modo.,86.57,31,45,2
Deben,Tierra cuales pequeño estoy paz mayoría prueba todos.,74.75,81,28,3
Pasa,Cultural jefe no total países mismo.,67.0,29,315,1
Máximo,Tener total intereses cargo.,13.08,9,381,3
Perdido,Te volvió especialmente industria movimiento parís.,21.17,39,11,1
Trabajadores,Personal viaje obstante aspectos noche dijo.,76.91,17,111,3
Último,Juan puso fecha arriba.,68.45,59,444,2
Baja,Sectores francia no peso razón mayores.,65.1,76,38,8
Mil,Televisión material objetivo personal.,93.74,64,207,9
Unidos,Varias civil camino nuevo torno.,16.13,85,214,8
Viene,Tener mejores riesgo.,46.8,77,430,1
Todavía,A a estructura veces demasiado obras va.,5.27,34,93,5
Especial,Programas españa cosa rosa época.,76.93,29,348,1
Cuadro,Estuvo cuales pedro niveles.,51.38,26,498,2
Chile,Cosas crecimiento m permite agua e control.,97.69,90,145,7
Unos,Propio sectores buena pacientes.,45.13,84,164,4
Explicó,Económico armas alguna respecto dar j otra.,43.18,36,226,9
Acuerdo,Deseo precisamente hacerlo alguna últimos.,71.98,97,174,3
Salida,Ello aquel sala siglo felipe temas siendo.,34.96,56,347,1
Realizar,Campaña pesetas acción siguientes formas estudio todos.,76.06,11,86,8
Principio,Gobierno para suerte fuentes decir cinco nuestros.,38.43,30,155,3
Miedo,Sociedad modelo para presenta conocer ministro.,22.25,12,487,4
Quizá,Gobierno salir produce energía función calidad pregunta volver.,47.82,62,457,6
Dólares,Formación futuro produce etc sigue piel construcción.,10.51,16,129,1
Especial,Soy etapa negro ciento no mirada.,70.41,33,221,2
Razones,Comisión libro agua banco.,36.43,69,337,3
Tipos,Central meses tipos medida obra alrededor.,58.88,25,40,7
Producción,Conciencia figura especie.,72.16,62,441,1
Prensa,Casos realizar argentina.,37.25,67,360,5
Llega,Ha pese vuelta d.,39.67,37,270,7
Semana,Control necesario pueda informe voluntad.,28.81,56,83,6
Puede,Dio resto comunidad jóvenes.,73.19,21,298,9
Algunos,Quien esas años allí alrededor resultado fue viaje.,61.63,34,490,8
Habrá,Términos necesario del defensa propios poco de sola.,87.21,56,199,9
Actividad,Son popular participación centro están metros máximo.,53.58,13,462,4
Comunidad,Conjunto quizá total estamos central común cada.,22.43,48,266,5
Me,Ayer libre sector rafael tú fuentes momento.,68.79,50,147,5
Ningún,Sistema elementos hijos cuanto j dónde mediante.,33.16,7,50,3
Salud,Acción en creo pp éste decir.,75.2,67,279,4
Medidas,Dónde j acciones miembros.,38.8,59,164,4
Espera,Período les estados ésta días.,73.74,19,169,2
Muchas,Prensa profesional etc grupos precio cultura lenguaje.,31.19,96,91,10
Posible,Tres demasiado dicen médico puede momento.,82.7,22,461,7
General,Meses tema ese especialmente.,24.77,84,354,2
Frente,Existe dar ex costa tú universidad amor parecía.,60.49,85,323,2
Fueron,Proyectos dijo real todo fueron derechos todos adelante.,33.28,33,251,4
Europa,Son ninguna sean josé.,63.01,92,312,6
Suelo,Diciembre ésta haber esfuerzo mitad m.,51.4,41,198,4
Podrá,Debido otras nada reforma.,87.03,62,346,5
Propuesta,Función hacen tengo d supuesto.,41.94,60,217,8
Manuel,Antonio mí campaña actividad nueva hicieron.,41.23,97,353,1
Llama,Espacio bajo actividades comunicación especial investigación base.,26.24,41,109,9
Relaciones,Manera sea nueva.,79.84,65,382,8
Mis,Suerte humano este ex buen final.,87.77,91,78,2
Muchos,María valores mundo final mercado algunas ocasión mil.,77.81,39,154,5
Principales,Ley señor energía carlos busca.,78.82,100,180,7
Podía,Conseguir servicio estaba popular estoy necesidad.,25.95,65,175,1
Último,Otras alrededor cuestión esos octubre imagen tener.,77.26,38,357,10
Fácil,Allí tenido juego hicieron deben horas.,54.24,84,378,2
País,Estructura unión propia tuvo media política.,44.14,95,177,9
Francisco,Millones consejo asociación otro.,44.58,6,73,1
Presencia,Decisión acuerdo tarde especie país cultural.,96.06,66,483,9
Libertad,Dos agua rodríguez horas.,98.76,33,333,4
Tan,Encuentra decisión incluso elecciones señor plaza distintos.,43.76,88,167,9
Torno,Natural puesto porque nombre.,74.48,24,5,9
Relación,Palabra necesario buena a palabra allá tales.,84.71,60,209,7
Ninguna,Suficiente mesa seis estudios c podemos cara.,14.81,18,252,7
Cultural,Dónde antonio humanos manuel sociales razón.,90.79,68,307,3
Cuestión,Edad dolor plazo memoria mantener pasa.,52.8,26,135,2
Llevar,Hicieron nunca entrar llevar.,95.21,30,115,5
Sociedad,Algunas violencia producción esfuerzo presidente.,99.54,18,493,7
Etc,Caso somos personas hubo.,51.3,80,389,2
Resultado,Mejor o al expresión.,98.6,35,21,9
Rodríguez,Aumento zona su da gonzález falta.,88.46,21,489,5
Boca,Alguna iglesia diario.,76.74,70,157,7
Mis,Tres razones madrid fiscal estados españa.,80.52,41,415,5
Decisión,Quiero dirección sino grado.,14.01,26,496,10
Adelante,Mi pequeño este mayores tu prueba entonces.,72.73,73,120,3
Camino,Proyectos naturaleza estados usted.,92.96,94,223,3
Dicen,Estaban eran pudo existencia actitud pensar.,15.02,7,41,10
Valores,Ideas lejos contra llama.,49.04,98,245,9
Pedro,Posición conocer precios producto ejército.,15.45,23,128,5
Experiencia,Fútbol entrada ver españa.,55.02,75,4,9
Papel,Día marco alguna programas importantes el pacientes.,59.83,31,140,10
Hermano,Juego médico puede.,85.72,42,97,8
Manuel,Esa acerca oficial incluso medidas libre.,97.23,24,279,4
Corazón,Mano etapa alguien misma entonces último estudio.,88.55,19,360,4
D,Hemos imágenes resto situación ciudad.,93.46,68,54,4
Lucha,Pudo ambiente europea hijo así.,19.38,57,283,7
Claro,Proceso estar construcción bastante justicia posibilidades.,86.92,51,180,2
Da,Esos casa control r madrid distintos.,28.66,54,59,4
Bueno,Cantidad llevar estados texto piel.,61.08,57,252,6
Ahora,He poder barcelona período construcción varios relación.,1.37,19,489,1
Opinión,U los tema antonio tampoco pública.,77.93,46,101,1
Energía,Fuentes hay actual.,73.82,95,368,8
Hechos,Punto voy tribunal tenemos.,90.86,90,108,9
Sabe,Menos según especie solo cuatro miguel palabra toda.,48.17,21,470,10
Resto,Respecto marzo ella juicio.,76.27,82,239,6
Aire,Pública grande conjunto acerca supuesto proyectos.,93.0,6,44,8
Poder,Muerto ésta embargo adelante.,55.35,85,28,7
Ver,Cuales dice mar nuevos resulta dar.,41.8,31,63,10
Orden,Aquel aquellas acción mundo cuenta casa padres.,98.83,77,475,5
Hubo,Serán comercio pasar grupos cierta.,10.14,28,419,2
Señor,Qué banco otro ante aquellas.,22.84,29,413,6
Fondo,Finalmente recuerdo de mitad dejar términos cuanto.,32.72,30,186,4
Hombre,Principal estado él.,62.0,98,247,2
Mundo,Palabra proyectos da secretario tengo tiempo.,48.63,78,480,10
Tenemos,Mano armas r aun.,83.17,18,150,4
Curso,Decisión causa tarde hay régimen económica principios mañana.,55.68,91,462,9
Felipe,Izquierda línea he aumento.,72.73,87,444,10
Sectores,Sangre respuesta jamás noviembre.,19.45,7,115,9
Pequeño,Público incluso amor pensar aspecto nueva embargo.,86.36,26,358,4
Servicio,Trabajo carta quiere flores.,46.73,50,167,9
Empresa,Encima quiere octubre ellos participación río.,90.37,69,78,5
Momento,Humanos gracias social nacional crecimiento principio más.,35.66,75,34,2
Mucha,Hija primero aquella américa.,20.79,11,160,10
Población,Mejores embargo último aire c respuesta ahora.,96.64,52,194,5
Corte,Defensa lucha nuestras respuesta nuestro él.,64.09,61,196,1
Marzo,Estaba río dijo.,26.72,10,412,6
Mayo,Lucha donde ambos plan reunión amor.,13.1,54,351,5
Siquiera,Derecha comunidad sería.,35.35,58,374,6
Derecha,Gran dijo precio muerte.,17.81,68,209,9
Evitar,Podrá larga ocasión comunidad.,86.81,42,65,8
Ellas,Camino algunos premio manos.,75.51,41,173,4
Su,Horas j ex cómo dar habla j.,65.43,87,22,6
Podría,Imágenes nuevas momento primero.,82.17,24,228,1
Situación,Pp busca expresión unión cuya aquel p pacientes.,97.76,34,370,2
Fecha,Estos siguientes tanto área ejército siglo.,70.37,22,262,8
Ambos,Segundo pueda estos r volvió.,80.14,23,194,4
Diversos,Movimiento se españa cuanto objetivo cuando.,57.26,42,149,6
Distintas,Española padre hechos además material millones líder.,36.32,70,368,10
Viene,Será parte juez volver viene servicio investigación amigos.,68.81,45,343,8
Primer,Cada paz semanas aquel datos.,12.42,90,114,5
Hijos,Participación dan cuya voy primeras.,59.3,49,47,1
Toda,Reforma amigos vez resulta aquel metros.,70.38,23,235,1
Visita,Propio luis ninguna fuerzas cuba.,92.62,20,23,4
Nombre,Orden posibilidad principal también hija josé.,61.29,34,316,4
Como,Octubre calle n parecía después zonas.,97.9,20,379,1
Sea,Luz aquellos propia dejar apoyo.,10.52,57,446,9
Podía,Nos tierra largo lado seguir economía partido.,80.46,46,191,6
Atrás,Reforma mujer mitad dinero era.,46.89,68,343,4
Arriba,Dio rey viene habían.,4.78,57,281,9
Lejos,Capaz energía todo g noviembre.,99.5,29,299,10
Puerto,Flores serán modelo sería buscar años otro favor.,37.85,65,284,4
Mí,Español plan equipo.,47.85,8,377,10
Real,Estaban especie pueblo muestra buenos.,27.87,30,13,3
Tenemos,Sangre música gobierno carta ministro.,91.59,21,296,9
Gracias,Actividades estudios dejar ahora ciudad hacerlo superior.,65.97,7,228,7
Nuestros,Favor jamás fuerza cine i.,34.23,76,368,1
Deja,Industria peso soy tenemos mí final nuevo precisamente.,40.87,26,362,2
Modo,Mercado luz ella estuvo.,6.55,31,338,2
Central,Propuesta para número derecho.,84.52,33,319,7
Etapa,También salida tenemos joven deben vuelve blanca.,72.62,44,302,4
Ésta,Hay electoral presente carrera quiero.,61.8,41,382,6
Justicia,Misma programas haber madrid especial cama riesgo.,9.03,36,388,4
Todo,Conjunto anterior semana estaba joven.,96.82,40,360,4
Pesetas,Ministerio vuelve su existe.,83.98,92,326,8
Día,Otros años madre perdido través humanos.,39.47,17,149,7
Obras,Hija será costa tema la.,70.89,72,34,2
Instituto,Trata líder se demás.,68.46,78,459,9
Conseguir,Por mañana aspecto paso único.,43.35,32,437,7
Puerta,Ha acciones ideas arriba formación.,34.82,33,472,2
Como,Particular cuando mayores izquierda cabeza sé.,59.41,63,416,9
Debido,Dan pensar naturaleza esfuerzo minutos banco.,55.22,81,305,6
Haciendo,Estoy nuestra argentina comercio.,59.53,86,269,10
Mientras,Principales ministro puerto presente condiciones cosa existencia.,84.22,97,303,2
Apoyo,Cabo creación grandes última luz.,27.08,32,209,8
Plazo,Hablar todas energía quedó.,43.87,47,384,8
Dos,Tiempo única ayer en.,83.32,5,395,4
Llega,Doctor especialmente fuera misma principios hacía mujer.,19.59,59,176,8
Aquel,Resto cabeza cuanto revolución instituto.,93.18,21,26,5
Tiempo,Apenas puerto persona persona.,56.03,6,123,8
Carta,Vino todos otro arriba forma mantener.,24.09,48,396,1
Ha,Tratamiento podría incluso intereses blanca quedó.,89.91,98,493,1
A,Realizar s carlos.,23.07,39,451,4
Dice,Padres habían habrá donde.,59.74,53,153,2
Juego,Época condiciones queda autoridades toma.,38.56,21,250,3
Demasiado,Prueba final tu nuevas.,38.01,78,30,5
Pasa,A lucha deja.,37.88,8,124,6
Hombres,Solamente figura futuro actitud mayores espera.,89.42,81,464,9
Encuentro,Calle político río junio.,83.81,12,116,2
Quiero,Formas crisis grupos tener.,93.15,93,191,3
Va,Contenido mes deja único cierta pregunta.,49.86,86,367,2
Creación,Solución socialista unidad aunque.,71.39,9,184,4
Favor,Dicho ayuda interior nuestro pueblo cine presenta familia.,85.57,38,275,8
Propia,Otras última situación tipo mal.,99.64,55,295,7
Último,Te prensa allí viejo cambio.,8.51,30,498,5
Respecto,Nivel encima hombres organización llegar como.,73.01,11,302,5
Me,Líder flores experiencia hasta propio este gente.,39.42,90,30,4
Orden,Más peor intereses.,26.11,78,10,9
Puntos,Ésta local r importantes tenían.,81.77,67,214,4
Cuando,Mí dos mujer quienes.,76.7,90,362,4
Carrera,Buen militar idea habrá pueda minutos tras favor.,63.92,54,357,1
Vía,San somos música precisamente encuentro.,85.21,50,62,6
Organización,Historia entrada falta suerte distintas garcía sobre.,18.16,88,399,9
Tengo,Veces presenta estaban dirección.,90.3,10,105,9
Necesidad,Considera suerte aunque viaje mirada piel puso exterior.,12.53,99,342,1
Españoles,Barcelona según españoles.,43.61,74,123,9
Niños,Última hicieron deseo líder.,79.4,66,258,9
Interior,Necesario dolor g diversos.,26.33,44,277,7
Ambos,Nuestro defensa fácil pasado líder edad deben.,47.53,71,81,4
Torno,Parece administración socialista trata aún.,38.04,32,102,6
Grande,Palabras desde memoria manuel parece llega podría.,35.43,14,375,6
Hizo,Teoría sabe sus está central les dado.,34.4,47,81,4
Cosas,Idea lópez américa paciente poder.,28.66,22,134,1
Premio,Deben movimiento artículo señaló lugar septiembre.,32.34,52,120,3
Texto,Necesidad adelante gonzález segundo persona.,43.81,31,224,8
Dónde,Larga padre valor ministerio bastante.,51.71,80,3,2
Derechos,Estados industria mismos sean ejemplo aún libertad.,54.28,31,4,6
Qué,Diciembre voy ambos modelo estaba campo.,57.6,13,327,5
Niño,Es hubiera origen habla saber padres ley.,22.78,63,39,3
Cómo,Si amigos línea saber ocho violencia.,41.61,72,172,10
Voz,Queda ejemplo vez.,4.87,16,294,7
Felipe,Diversas especie materia posible aquellos.,76.19,65,77,2
Pronto,Incluso había o embargo otras prueba.,32.78,30,220,5
Premio,Distintas cantidad vamos nuevo frente civil nuevos.,20.67,83,156,1
Carne,Rodríguez pensar señor.,81.62,19,232,4
Tanto,Lucha partido unidos posición e tener francia.,99.89,61,434,5
Además,Plazo enfermedad materia oficial.,17.45,91,395,5
Permite,Mar campaña encontrar principios bastante podría.,84.37,50,445,7
Libros,Efectos unos términos plaza centro argentina todas riesgo.,79.92,55,382,10
Encontrar,Largo pone podía hay llevar jamás.,33.07,71,4,4
Puesto,Servicios país capacidad aquellas productos tema.,1.19,63,311,2
Sea,Jamás largo podía si saber.,46.6,8,172,8
Fiscal,Este pasó quizá.,50.99,27,198,6
Saber,Ambos éste buenos presencia llamado mayoría.,70.2,58,119,8
Grande,Ahora dan economía.,15.98,30,277,5
Mundial,Como bueno le derecha políticos.,31.52,66,172,4
Tampoco,Dice cuenta tribunal idea oficial.,70.75,62,410,1
Quedó,Rosa fácil hecho carlos revolución comunidad naturaleza.,55.22,90,200,8
Palabra,Rafael campo hicieron.,5.61,73,167,3
Mitad,Prueba poco cámara cinco pasar existen estoy.,74.19,60,211,3
Hacen,Dónde además cama menor.,45.83,35,380,6
Carrera,Proyectos objetivo ellos color.,29.7,51,391,3
Entre,Nuevo central rey nuestro parte humano haciendo ellas.,71.74,56,114,9
Fue,Falta enfermedad humano servicio están podía.,55.71,64,83,6
Si,Española médico i debe donde.,30.49,50,230,10
Posible,Toma libro teatro ellas boca mano reforma.,88.1,26,257,8
Contra,Miembros actitud parte relaciones política hacía antonio.,82.1,66,433,4
Hasta,Jefe unión te especial políticas.,96.05,91,305,7
Jóvenes,Siguiente modelo pablo g vuelve amigos méxico.,61.12,47,33,7
Muchas,Nueva prueba país sur.,34.75,25,187,6
Presencia,Seis argentina valores rodríguez.,40.6,56,285,3
Río,Decía ejemplo caso partir mayores.,41.71,13,457,9
Estos,Blanco les entonces quién ellas.,57.19,17,468,8
Solamente,Jefe corazón cambio medida había.,80.45,13,14,8
Embargo,Militar camino siglo instituto muerte.,7.74,50,393,1
Casa,Unos blanca teatro tener dicho vino.,35.84,57,10,4
Debido,Palabra cómo ministro teoría debe cuba pueblo.,85.36,46,115,3
Iba,Libertad puerto deben pregunta.,35.62,5,336,5
Pública,Piel zonas propio propios mayor esto septiembre puerto.,94.96,74,331,8
Francia,Era dar sólo diferentes seis.,14.76,44,337,4
Ninguna,Junto momento posibilidades por seguridad lucha antes permite.,31.65,21,437,9
Señor,Volver parís conjunto señor.,24.65,74,148,3
Bueno,Quién problemas obstante.,10.23,46,274,3
Cada,Tiempo muchos jefe.,18.43,29,492,2
Quizá,Quizá ese siete educación.,3.79,31,154,10
Norte,Pasar días gonzález principios humana según.,5.52,88,207,10
Concepto,Pública política energía aún permite vía sería.,79.01,25,356,5
Capaz,Período martín libertad programa.,54.71,87,357,10
Época,Cambios película mano te varios buenos siglo dos.,14.09,89,330,10
Instituciones,Debía dice estuvo horas tiempos francisco o.,66.69,15,421,2
Pueda,Mira aquellos cual garcía serán carta mayo imágenes.,48.72,36,61,9
Menos,Rodríguez son silencio modelo.,72.24,13,397,1
Pasa,Todavía algunos cuanto has parecía.,8.22,46,218,1
Pocos,Podría diversos nos cuarto palabras color alta.,70.08,100,377,6
Tiempo,Aquellas junio mucho.,63.52,91,393,6
Resto,Sido dice empresa esos mes socialista.,94.33,21,327,5
Algunas,Nuestro deseo calle como española contra.,26.66,89,448,3
Medio,Frente u punto mejor.,61.58,73,137,6
Autor,Final enfermedad local creo.,54.28,47,13,6
Productos,Cabeza interior mejor buena.,49.01,64,178,8
Lejos,Ser amor pueden comercio lópez horas.,59.56,68,466,3
Medios,Propios son existencia llega tienen formación.,39.97,87,497,3
Fue,Camino elecciones sigue joven ayer.,44.91,18,255,4
Policía,Temas instituto ni crisis todavía sino mis.,49.72,8,329,9
Desarrollo,Derecha cuenta años había gonzález.,70.82,50,41,5
Como,Razón fue bien realizar explicó dolor ley efectos.,17.97,76,63,3
Política,A quien p santa.,83.41,97,346,5
Hacen,Vía encuentran hija instituciones reforma próximo.,29.96,72,424,1
Políticos,Director voz niveles mira general madrid dejó.,94.22,50,125,3
Nada,Eran consecuencia alguna casos análisis modo pone.,44.48,24,101,3
Él,Casos favor manera vuelve vida.,15.68,23,257,9
Juez,Cinco sistema máximo recuerdo respuesta suerte tiempos.,76.55,59,166,6
Ojos,Abril además quizá.,60.59,84,414,10
Construcción,Serán siglo hechos premio.,6.69,31,217,9
Intereses,Distintas abril gracias libre marco.,33.26,43,386,1
Aquellos,República hijos millones importancia han.,8.05,71,374,7
Nuevos,Mercado paz central unidos siquiera aquel local violencia.,96.97,55,157,6
Ayer,Afirmó energía sean propio tu.,20.04,31,287,1
Producción,Actividades cuadro tienen cultural sangre través.,1.58,62,467,9
Deja,Aquí nosotros libro organización dos.,30.72,68,185,5
Presente,Le mar estilo causa destino diciembre y.,67.76,74,163,7
Creación,Cual se república.,3.75,90,378,7
Común,Pregunta naturaleza ii pesetas control maría sociedad.,81.51,51,439,6
Hombre,La especial entonces pasado amor presidente muy demasiado.,22.67,22,255,2
Unas,Miembros supuesto duda.,34.16,22,276,5
Fuerzas,Revolución temas humana sur bajo cuenta.,44.77,13,337,2
Siempre,Que pero contenido vamos.,93.37,51,357,2
Donde,Palabras cerca encontrar pedro salir apenas ciudad.,77.22,42,193,10
Demás,Hijo más familia luz ello debe una.,76.07,44,214,6
Francisco,Siempre sector toda peso carne.,30.88,11,233,9
Segunda,Llama personal cada primero acciones tema.,95.65,77,145,10
Siglo,Objetivo pasado amigos aparece muerto mayo puede.,41.16,62,166,10
Negro,Defensa atrás suelo hubo crisis américa.,40.76,30,261,10
Felipe,O nuestro vuelta propia decisión entonces otras.,95.61,67,340,4
Primero,Historia consecuencia estamos diario existencia instituto fue.,64.67,71,79,8
Dirección,Puerta calidad fiscal.,65.13,71,419,7
Cámara,Tres san pasó principales cultura.,30.7,13,484,8
Dolor,Acuerdo pedro acto arte manuel vamos autor.,33.91,16,254,4
Club,Gracias otra cabo precios cuadro propios manera.,59.31,22,20,4
G,U relación manos control están blanco gente.,77.4,37,78,4
Hermano,Millones contrario noche vamos tiempos.,85.65,98,421,1
Es,Sí ejército plan es.,61.95,87,365,5
C,Servicio voy exterior.,56.81,5,346,1
Tenemos,Algunos después hacer llegado alguna un estoy.,56.54,26,22,2
Internacional,Medios esas hacía interés administración diciembre allí.,41.48,94,265,1
Quiero,Muy nadie mi.,45.28,95,105,5
Ve,Riesgo tan vuelta iba.,73.3,14,234,8
Acuerdo,Aquel relaciones modo ninguna niños primeros este.,81.51,43,236,8
Caso,Organización tratamiento llamado nuevos maría tratamiento unidos.,3.64,5,43,9
Aquellas,E llega asunto riesgo se resultados perdido.,70.06,68,19,1
Análisis,Segunda bien puedo ciento.,22.36,77,153,9
Nueva,Paciente haciendo camino señor diez.,13.51,36,123,9
Información,Corte formación generales industria común juego.,12.74,31,327,9
Nueva,Un paso cuando público.,26.26,83,278,8
Larga,Mujer sueño bastante.,95.33,33,366,2
Mejor,Importantes político cual encuentra.,48.96,33,376,4
Las,Familia contra ésta enero personas compañía existe capital.,91.28,10,202,1
Ex,Campaña peso posición u sistemas.,15.77,28,182,7
Palabra,Producción qué ambiente política está norte minutos.,37.14,85,367,7
Unión,Aparece especialmente mucha aquella eso.,20.8,79,297,7
Él,Cine tiempo española conjunto aquellos j.,12.8,89,344,10
Cuba,Quería fondo proyectos por.,24.41,81,337,1
Materia,Hora después fuerte diez dijo propios.,72.71,79,65,9
Servicios,Blanca importantes debía sean intereses estoy humana.,54.01,24,359,1
Comisión,Palabra construcción nuevas plazo derecha grupos mil vino.,16.1,72,419,8
Primera,Dentro real semanas gran.,95.24,94,75,1
Viaje,Conseguir parís es señor suerte número.,62.92,99,392,5
Pequeño,Horas edad etapa has difícil.,71.42,90,238,9
Tampoco,El toda él agua.,40.14,61,247,7
Van,Rafael español quedó anterior elementos centros hombre.,9.99,95,363,7
Los,Varias sector todo casi entonces.,94.36,62,71,2
Estos,Obstante queda interior mal.,82.79,86,470,2
Personal,Anterior práctica unas todos vuelta tierra.,53.35,31,456,1
Necesidad,Policía marzo crisis conjunto.,79.69,81,127,9
Muy,Éste prensa empresas tú algunos mayores.,91.87,100,122,2
Revolución,Años trabajar hacía antes éxito general.,48.42,89,95,3
Origen,Muerto actividad revolución diferencia derechos cuestión.,6.25,68,297,8
He,Riesgo sabe productos fuego contenido cuatro.,65.8,93,355,3
