nombre,descripcion,precio,stock,id_tienda,id_categoria
Entre,Llama situación se tenido creación estoy cargo quiere.,66.12,87,400,9
Fuego,Ministerio resultados práctica grande causa primero.,57.25,56,376,5
Le,Estuvo teoría méxico sí afirmó salud he.,87.0,42,34,2
Cerca,Los comunicación pocos van paciente.,89.54,44,186,1
Junio,Llamado amor busca.,87.52,34,366,6
Principal,Aire distintas cultura valor ni siempre madre s.,65.58,99,273,8
Queda,Juez zona espera quién.,16.2,10,368,4
Fuerte,Razones congreso estudios centro.,8.86,94,243,1
Minutos,Ejército juego madrid algún.,69.77,92,169,6
Ocasión,Muchos sangre especialmente suelo desde actitud ellos.,50.65,94,389,4
Primeros,Lejos miembros imágenes lucha m del tres.,50.22,39,431,8
Señor,Acciones muchos sino.,38.56,31,475,1
Mucho,Armas hemos fútbol seguridad deben final les.,24.99,5,184,5
Desarrollo,Estamos podemos economía enero grande niño señaló.,28.24,42,430,2
Gobierno,Distintos casa oposición.,8.15,49,217,5
Viaje,Guerra uno jóvenes cantidad siquiera.,86.83,59,119,6
Riesgo,Dar posible blanco maría propia dado pueda.,23.9,10,111,9
Imágenes,Problemas fuerzas estudio estuvo cultura.,92.32,38,405,2
Siete,Lo presencia favor yo existencia.,85.97,39,123,3
Respecto,Pueden pese mal recursos principal buena final marzo.,74.73,48,338,1
Autoridades,Sí enero profesional difícil sangre.,41.54,69,37,1
Más,Segundo importante fecha serán busca habla.,34.48,77,305,10
Obra,Podrá mejor muerte y peso todas g.,98.65,35,214,8
Fecha,Cierto muy creo mesa.,1.08,79,168,5
Supuesto,Tanto instituto sur.,12.78,52,203,8
Costa,Peor tras mucho también conseguir.,69.98,99,423,4
Pasado,Español somos cualquier siguiente anterior afirmó ha.,47.05,40,79,5
Título,Noviembre américa medida aún.,85.54,76,149,8
Cosas,Fueron juego resulta tribunal creación solución gente.,88.86,100,72,1
Misma,Corazón primer datos formación si.,73.15,6,489,1
Octubre,Aun dios hombres eran seguir hacerlo club.,57.7,55,64,1
Dentro,Mujer hombre más política luz serie.,76.79,18,88,8
Dirección,Otra como cuadro obstante buena demás.,99.79,99,91,6
Queda,Existen posición central g eso televisión y tú.,90.79,77,376,9
C,En revolución ley estudio.,97.43,78,461,5
Europa,Primer tú servicios comenzó todo ni.,45.71,53,407,8
Momentos,Alguien ambos niveles diversas.,83.44,12,402,10
Algunas,Adelante psoe miedo fondo acto.,62.56,50,245,1
Escuela,Propia juicio amigos pasar dirección habrá.,32.84,43,232,5
Marzo,Suelo mucho además tiempos formación estado primeras.,74.15,38,34,6
Hubo,Cualquier fin presidente creo nombre allí proyectos.,44.36,40,223,8
Revolución,Llegado gente minutos alguien función lópez mejor.,97.25,96,154,6
Tres,Máximo nuestros solamente persona director cultura estamos.,39.6,36,403,5
Esto,Millones próximo producto posición cuatro tales.,70.28,23,266,7
Frente,Yo principios padre millones carlos flores fuentes.,39.89,9,385,5
Aunque,Única supuesto r hijos tarde tu dio.,93.5,36,292,8
Ocho,Artículo cuales varias proceso popular.,67.3,86,85,10
Existen,Importancia vio interés tan historia.,97.37,91,137,5
Recursos,Área persona bueno revolución.,65.77,16,427,3
Octubre,Nacional tipo estilo dar te juan cultural.,73.71,64,196,9
Papel,Campo instituto tengo santiago hoy.,97.1,6,19,2
Eso,Voluntad mejor organización datos iglesia.,2.35,22,98,6
Temas,Entonces ahí niveles personal.,61.94,90,329,4
Viene,Pequeña serán primeros derechos suerte alguien eso.,49.32,30,416,3
Fue,Conocer fuera r aquella toda población constitución felipe.,31.53,38,316,4
Septiembre,Muchos don todas quién además.,99.47,47,417,2
Aquel,Realizar demasiado tales hijo.,68.11,14,165,5
Voluntad,Muestra nuestras encontrar.,3.8,54,215,5
Cambios,Buena qué ningún industria título.,38.6,49,78,9
Cada,Dice meses justicia tribunal te sería.,75.44,58,182,6
Da,Mucho misma fuerzas mesa juan así.,78.26,32,490,5
Tampoco,Dejó unidos resultados revolución voz las.,84.56,26,279,5
Partido,París quién boca llegar razón presidente alto buscar.,6.1,57,296,8
Varios,Segunda durante médico artículo vía rafael.,9.78,47,12,8
Pone,Pronto quiero cabo programas.,67.05,24,266,2
Llegado,Don resulta jorge.,89.9,51,302,6
Democracia,Siete diciembre primeros julio oro película modo.,84.89,77,460,5
Cuarto,Ellos algunos joven mejores.,81.4,72,208,8
Habría,Su bajo autor armas.,17.29,20,71,9
Datos,Lugar proyecto luego seis posibilidades cultura.,62.96,94,270,8
Cuenta,Espera poner situación curso s voz.,97.24,86,365,6
Siquiera,Imposible sola técnica ambos central teoría.,85.73,80,96,6
Pasa,Una cuya local interior derecho justicia.,43.97,90,185,6
Importantes,Formación palabra investigación compañía agua.,43.11,95,232,8
Explicó,Particular norte adelante ley s acerca especialmente.,90.7,82,317,7
Mayores,Luz existencia vio tras.,1.63,74,215,1
Acciones,Supuesto quería esto mirada madre serie general junto.,18.81,68,223,9
Blanco,Puede tierra muerto mes.,23.28,65,401,3
Profesional,Ministerio ir corte tanto teatro humano supuesto.,91.53,70,69,4
Aspectos,Esa blanco edad.,75.93,32,140,2
Natural,Pueda pp decisión director libros.,62.24,15,127,4
